{
  "protocolVersion": "1",
  "decisionAuthority": "instructions",
  "mode": "dry-run",
  "prNumber": 994,
  "prHeadSha": "0123456789abcdef0123456789abcdef01234567",
  "ready": false,
  "blockers": [
    {
      "gate": "advisory-wait",
      "detail": "f3Outcome is \"WAIT\" (expected \"SATISFIED\")"
    }
  ],
  "mergeCommand": "gh pr merge 994 --merge --match-head-commit 0123456789abcdef0123456789abcdef01234567",
  "merged": false,
  "mergeResult": "",
  "adminFallbackUsed": false,
  "localHeadDrift": null
}
